Sheet: Service Excellence
A1: Question | B1: Score
A2: Our company tests and measures everything to ensure customer satisfaction. | B2: ${data.c0q0}
A3: We survey our clients regularly to determine how we can better serve them. | B3: ${data.c0q1}
A4: We analyse our mistakes as both a company and as individuals and learn from them. | B4: ${data.c0q2}
A5: We choose our clients to fit our way of doing business. | B5: ${data.c0q3}
A6: Our direction and people can change instantly to meet our customers needs. | B6: ${data.c0q4}
A7: I would gladly give up or postpone a sale to meet my customer service agenda. | B7: ${data.c0q5}
B9: =IF(COUNT(R[-7]C:R[-2]C) > 0, ROUND(AVERAGE(R[-7]C:R[-2]C) * 50, 0)) -> 58

Sheet: Sales Drive
A1: Question | B1: Score
A2: Sales processes are managed weekly and measures are taken to ensure sales forecast are met. | B2: ${data.c1q0}
A3: My sales force is successful and undergoes regular training on both product and selling skills. | B3: ${data.c1q1}
A4: My sales force operates as a team. | B4: ${data.c1q2}
A5: A sales rewards programme is in place. | B5: ${data.c1q3}
A6: Our sales volumes are continuously increasing. | B6: ${data.c1q4}
A7: I am completely satisfied with my market share. | B7: ${data.c1q5}
B9: =IF(COUNT(R[-7]C:R[-2]C) > 0, ROUND(AVERAGE(R[-7]C:R[-2]C) * 50, 0)) -> 83

Sheet: Targeted Marketing
A1: Question | B1: Score
A2: The company has found a niche for its product and no longer competes on price. | B2: ${data.c2q0}
A3: We only advertise when we can test and measure the results. | B3: ${data.c2q1}
A4: We constantly educate our clients on the benefits of our products and services. | B4: ${data.c2q2}
A5: Every member of our team knows and understands our unique selling proposition. | B5: ${data.c2q3}
A6: We always educate on value and never market on price. | B6: ${data.c2q4}
A7: We survey people who do not buy our products to improve our product or service. | B7: ${data.c2q5}
B9: =IF(COUNT(R[-7]C:R[-2]C) > 0, ROUND(AVERAGE(R[-7]C:R[-2]C) * 50, 0)) -> 25

Sheet: High-Performing Team
A1: Question | B1: Score
A2: Every member of the team is operating at their full potential. | B2: ${data.c3q0}
A3: There is synergy among all the members of our team. | B3: ${data.c3q1}
A4: Team members are listened to and are encouraged to speak up and make recommendations. | B4: ${data.c3q2}
A5: My team members are accountable for their performance. | B5: ${data.c3q3}
A6: Reporting systems are in place and adhered to. | B6: ${data.c3q4}
A7: Every member of the team enjoys their work. | B7: ${data.c3q5}
B9: =IF(COUNT(R[-7]C:R[-2]C) > 0, ROUND(AVERAGE(R[-7]C:R[-2]C) * 50, 0)) -> 83

Sheet: Strong Strategy Drive
A1: Question | B1: Score
A2: The company has a formal business plan that sets out its strategic objectives. | B2: ${data.c4q0}
A3: The companyʼs business plan is being used, tested, measured, and updated quarterly. | B3: ${data.c4q1}
A4: Regular planning strategy sessions are conducted with staff and management. | B4: ${data.c4q2}
A5: The company has very good knowledge of its competitors and their practices. | B5: ${data.c4q3}
A6: The company has the right allies to support the organisation. | B6: ${data.c4q4}
A7: The company for the most part is going in the direction you intended it to go from its inception. | B7: ${data.c4q5}
B9: =IF(COUNT(R[-7]C:R[-2]C) > 0, ROUND(AVERAGE(R[-7]C:R[-2]C) * 50, 0)) -> 92

Sheet: Visible Cashflow
A1: Question | B1: Score
A2: The company has an annual budget. | B2: ${data.c5q0}
A3: Budgeting processes are clearly defined and adhered to. | B3: ${data.c5q1}
A4: Financial statements are done monthly. | B4: ${data.c5q2}
A5: Supplier and Service Provider invoices are routinely paid on time. | B5: ${data.c5q3}
A6: Terms are negotiated with all suppliers, including early payment discounts. | B6: ${data.c5q4}
A7: All budgeting is ambitious. | B7: ${data.c5q5}
B9: =IF(COUNT(R[-7]C:R[-2]C) > 0, ROUND(AVERAGE(R[-7]C:R[-2]C) * 50, 0)) -> 50

Sheet: Productivity Prioritisation
A1: Question | B1: Score
A2: Operations are fully managed by systems. | B2: ${data.c6q0}
A3: Staff are accountable to complete their tasks; their deliverables are monitored and supported. | B3: ${data.c6q1}
A4: The company is driven by both quality and profit; both are measured regularly. | B4: ${data.c6q2}
A5: Every meeting accomplishes some specific objective or outcome. | B5: ${data.c6q3}
A6: Meetings between staff are scheduled in advance; spur-of-the-moment encounters are avoided. | B6: ${data.c6q4}
A7: Staff have the opportunity to communicate openly about obstacles to their production. | B7: ${data.c6q5}
B9: =IF(COUNT(R[-7]C:R[-2]C) > 0, ROUND(AVERAGE(R[-7]C:R[-2]C) * 50, 0)) -> 42

Sheet: Profitability Monitoring
A1: Question | B1: Score
A2: Profit margins have increased over the last two years. | B2: ${data.c7q0}
A3: Profits forecast increase 15% per annum. | B3: ${data.c7q1}
A4: Debt service decrease by 20% per annum. | B4: ${data.c7q2}
A5: Individual responsibilities for achieving financial goals are clearly defined. | B5: ${data.c7q3}
A6: Staff and facilities are at 80% capacity. | B6: ${data.c7q4}
A7: Profitability as a rule is higher than the industry average and is not an issue for the company. | B7: ${data.c7q5}
B9: =IF(COUNT(R[-7]C:R[-2]C) > 0, ROUND(AVERAGE(R[-7]C:R[-2]C) * 50, 0)) -> 67

Sheet: Work-Life Balance - Wellbeing
A1: Question | B1: Score
A2: Everyone feels energised at the beginning of the week and fulfilled at the end of it. | B2: ${data.c8q0}
A3: Our employees work an average of less than 50 hours per week. | B3: ${data.c8q1}
A4: I am putting aside funds regularly with which to become financially independent. | B4: ${data.c8q2}
A5: We all have at least 5 daily well-being habits and I do them consistently. | B5: ${data.c8q3}
A6: My days are well planned and I never run on energy. | B6: ${data.c8q4}
A7: I am happy with the amount of money I make. | B7: ${data.c8q5}
B9: =IF(COUNT(R[-7]C:R[-2]C) > 0, ROUND(AVERAGE(R[-7]C:R[-2]C) * 50, 0)) -> 83

Sheet: Effective Leadership
A1: Question | B1: Score
A2: Our vision is clear across the business. | B2: ${data.c9q0}
A3: We all lead by example. | B3: ${data.c9q1}
A4: We all strive for excellence, but accept and remove imperfection. | B4: ${data.c9q2}
A5: We build a culture of accountability. | B5: ${data.c9q3}
A6: We learn from our own mistakes. | B6: ${data.c9q4}
A7: We are all self aware, and support each other as we understand each other’s strengths and weaknesses. | B7: ${data.c9q5}
B9: =IF(COUNT(R[-7]C:R[-2]C) > 0, ROUND(AVERAGE(R[-7]C:R[-2]C) * 50, 0)) -> 33

Sheet: TOTALS
A1: Category | B1: Score / 100
A2: Service Excellence | B2: ='Service Excellence'!R[7]C -> 58
A3: Sales Drive | B3: ='Sales Drive'!R[6]C -> 83
A4: Targeted Marketing | B4: ='Targeted Marketing'!R[5]C -> 25
A5: High-Performing Team | B5: ='High-Performing Team'!R[4]C -> 83
A6: Strong Strategy Drive | B6: ='Strong Strategy Drive'!R[3]C -> 92
A7: Visible Cashflow | B7: ='Visible Cashflow'!R[2]C -> 50
A8: Productivity Prioritisation | B8: ='Productivity Prioritisation'!R[1]C -> 42
A9: Profitability Monitoring | B9: ='Profitability Monitoring'!RC -> 67
A10: Work/Life Balance - Wellbeing | B10: ='Work-Life Balance - Wellbeing'!R[-1]C -> 83
A11: Effective Leadership | B11: ='Effective Leadership'!R[-2]C -> 33